{
  "network_id": "sonantia-network",
  "protocol_version": "1.0",
  "network_epoch": "SN1-2026-08-02",
  "document_type": "core-state",
  "node_id": "N02",
  "last_own_sequence": 742,
  "last_message_id": "SN1-N02-2026-10-25T19-43-42Z-000742",
  "last_event_sequence": 6704,
  "generator_state": {
    "phrase_cursor": {
      "catalog_hash": "sha256:cc084f35f041392fadf131a3692c722505bc9c54f394fcb2f8ab90135011d72b",
      "phrase_count": 8192,
      "round": 1,
      "position": 640
    }
  },
  "updated_at": "2026-10-25T19:43:42Z"
}
